{
  "dropped": [
    {
      "code": "protocol_unsupported",
      "index": 1,
      "reason": "unsupported protocol \"trojan-go\"",
      "ref": "x"
    }
  ],
  "meta": {
    "body_kind": "xray-array"
  },
  "nodes": [
    {
      "entry": {
        "server": "a.example",
        "server_port": 443,
        "type": "vless",
        "uuid": "11111111-2222-3333-4444-555555555555"
      },
      "kind": "outbound",
      "label": "unsup",
      "scheme": "vless"
    }
  ],
  "v": 1
}
